<?xml version="1.0"?>
<xs:schema version="1.0" xmlns:xs="http://www.w3.org/2001/XMLSchema" elementFormDefault="qualified">
    <xs:element name="libro">
        <xs:complexType>
            <xs:sequence>
                <xs:element name="titulo" type="xs:string"/>
                <xs:element name="autor" type="xs:string"/>            
                <xs:element name="capitulo">
                    <xs:complexType>
                        <xs:sequence>
                            <xs:element name="titulo" type="xs:string"/>
                            <xs:element name="p" maxOccurs="unbounded">
                                <xs:complexType mixed="true">
                                    <xs:choice minOccurs="0" maxOccurs="unbounded">
                                        <xs:element name="mi" type="xs:string"/>
                                        <xs:element name="i" type="xs:string"/>
                                    </xs:choice>
                                </xs:complexType>
                            </xs:element> 
                        </xs:sequence>            
                    </xs:complexType>
                </xs:element>
            </xs:sequence>
        </xs:complexType>
    </xs:element>
</xs:schema>