<?xml version="1.0" encoding="UTF-8"?>
<libro xmlns:xsi="http://www.w3.org/2001/XMLSchema-instance" xsi:noNamespaceSchemaLocation="libro.xsd">
    <titulo>XML F치cil</titulo>
    <autor>Laura</autor>
    <capitulo>
        <titulo>Introducci칩n</titulo>
        <p>Primeros pasos en <mi>XML</mi>.</p>
        <p>C칩mo usar <i>estructuras b치sicas</i>.</p>
    </capitulo>
</libro>